{
  "contract_version": "0.1.0",
  "operation": "audit",
  "scope_mode": "selection",
  "review_profile": "critical_text",
  "selection": {
    "source_revision": "rev-example",
    "segment_id": "t00017",
    "format_node_id": "node-example",
    "span": {"start": 0, "end": 120},
    "source_hash": "sha256:0000000000000000000000000000000000000000000000000000000000000000"
  }
}

